* tcpdump usage

** docs
*** TCP FLAGS
PSH     =  [P] (Push Data)
RST     =  [R] (Reset Connection)
SYN     =  [S] (Start Connection)
FIN     =  [F] (Finish Connection)
SYN-ACK =  [S.] (SynAcK Packet)
           [.] (No Flag Set)

** examples
*** 指定 interface
=tcpdump -i en0=

*** 指定主机和端口
=tcpdump tcp port 23 and host 10.1.0.1=


** QA
*** 在 osx 上，建立连接会有 4 次握手？
#+BEGIN_SRC
19:29:37.157437 IP localhost.54871 > localhost.23333: Flags [S], seq 4183558234, win 65535, options [mss 16344,nop,wscale 5,nop,nop,TS val 3374013330 ecr 0,sackOK,eol], length 0
19:29:37.157538 IP localhost.23333 > localhost.54871: Flags [S.], seq 1658355569, ack 4183558235, win 65535, options [mss 16344,nop,wscale 5,nop,nop,TS val 3374013330 ecr 3374013330,sackOK,eol], length 0
19:29:37.157554 IP localhost.54871 > localhost.23333: Flags [.], ack 1, win 12759, options [nop,nop,TS val 3374013330 ecr 3374013330], length 0
19:29:37.157567 IP localhost.23333 > localhost.54871: Flags [.], ack 1, win 12759, options [nop,nop,TS val 3374013330 ecr 3374013330], length 0
#+END_SRC

在 wireshark 中可以发现，最后一个包的作用是 TCP WINDOW UPDATE，并不是必须的。
在 Linux 上测试的话，我们可以发现，不会出现最后这个包。

那为什么要有 TCP WINDOW UPDATE 这么一次操作呢？暂不深究 [[https://stackoverflow.com/questions/1466307/what-is-a-tcp-window-update][参考资料]]
